{
  "$schema": "https://json-schema.org/draft/2020-12/schema",
  "title": "Canonical Object",
  "type": "object",
  "required": ["object_id", "object_type", "as_of", "source_system", "cadence"],
  "properties": {
    "object_id": {"type": "string"},
    "parent_id": {"type": "string"},
    "object_type": {"type": "string"},
    "as_of": {"type": "string"},
    "source_system": {"type": "string"},
    "cadence": {"type": "string"},
    "legal_entity_id": {"type": "string"},
    "line_of_business_id": {"type": "string"},
    "relationship_id": {"type": "string"},
    "account_id": {"type": "string"},
    "instrument_id": {"type": "string"},
    "transaction_event_id": {"type": "string"}
  }
}
