[
  {
    "object_id": "entity-bank-holdco",
    "object_type": "legal_entity",
    "as_of": "2026-04-24T00:00:00Z",
    "source_system": "synthetic-ledger",
    "cadence": "close"
  },
  {
    "object_id": "commercial-banking",
    "parent_id": "entity-bank-holdco",
    "object_type": "line_of_business",
    "as_of": "2026-04-24T00:00:00Z",
    "source_system": "synthetic-ledger",
    "cadence": "daily",
    "legal_entity_id": "entity-bank-holdco",
    "line_of_business_id": "commercial-banking"
  },
  {
    "object_id": "rel-synthetic-001",
    "parent_id": "commercial-banking",
    "object_type": "relationship",
    "as_of": "2026-04-24T00:00:00Z",
    "source_system": "synthetic-crm",
    "cadence": "daily",
    "legal_entity_id": "entity-bank-holdco",
    "line_of_business_id": "commercial-banking",
    "relationship_id": "rel-synthetic-001"
  },
  {
    "object_id": "account-credit-001",
    "parent_id": "rel-synthetic-001",
    "object_type": "account",
    "as_of": "2026-04-24T00:00:00Z",
    "source_system": "synthetic-core-banking",
    "cadence": "intraday",
    "legal_entity_id": "entity-bank-holdco",
    "line_of_business_id": "commercial-banking",
    "relationship_id": "rel-synthetic-001",
    "account_id": "account-credit-001"
  },
  {
    "object_id": "instrument-loan-001",
    "parent_id": "account-credit-001",
    "object_type": "instrument",
    "as_of": "2026-04-24T00:00:00Z",
    "source_system": "synthetic-core-banking",
    "cadence": "daily",
    "legal_entity_id": "entity-bank-holdco",
    "line_of_business_id": "commercial-banking",
    "relationship_id": "rel-synthetic-001",
    "account_id": "account-credit-001",
    "instrument_id": "loan-001"
  }
]
